{
  "name": "Example Title",
  "servicetype": "example_value",
  "ipv46": "example_value",
  "port": 10,
  "ipset": "example_value",
  "range": 10,
  "ippattern": "example_value",
  "ipmask": "example_value",
  "td": 10,
  "lbmethod": "example_value",
  "hashlength": 10,
  "netmask": "example_value",
  "v6netmasklen": 10,
  "backuplbmethod": "example_value",
  "persistencetype": "example_value",
  "persistmask": "example_value",
  "v6persistmasklen": 10,
  "persistencebackup": "example_value",
  "timeout": 10,
  "persistavpno": [],
  "cookiename": "example_value",
  "rule": "example_value",
  "listenpolicy": "example_value",
  "listenpriority": 10,
  "resrule": "example_value",
  "push": "example_value",
  "pushlabel": "example_value",
  "pushmulticlients": "example_value",
  "comment": "example_value",
  "clttimeout": 10,
  "somethod": "example_value",
  "sopersistence": "example_value",
  "sopersistencetimeout": 10,
  "sothreshold": 10,
  "healththreshold": 10,
  "redirecturl": "https://www.example.com",
  "downstateflush": "example_value",
  "disableprimaryondown": "example_value",
  "insertvserveripport": "example_value",
  "vipheader": "example_value",
  "authenticationhost": "example_value",
  "authentication": "example_value",
  "authn401": "example_value",
  "authnvsname": "example_value",
  "icmpvsrresponse": "example_value",
  "rhistate": "example_value",
  "newservicerequest": 10,
  "newservicerequestunit": "example_value",
  "newservicerequestincrementinterval": 10,
  "minautoscalemembers": 10,
  "maxautoscalemembers": 10,
  "skippersistency": "example_value",
  "appflowlog": "example_value",
  "state": "example_value",
  "connfailover": "example_value",
  "redirurl": "https://www.example.com",
  "curstate": "example_value",
  "effectivestate": "example_value",
  "status": 10,
  "lbrrreason": 10,
  "totalservices": 10,
  "activeservices": 10,
  "statechangetimesec": "example_value",
  "tickssincelaststatechange": 10,
  "health": 10,
  "isgslb": true
}